,SQ_CANDIDATO,NM_CANDIDATO,SG_UF,NM_UE,DS_CARGO,SG_PARTIDO,DS_GENERO,DS_GRAU_INSTRUCAO,DS_COR_RACA,DS_OCUPACAO,totalBens
0,130001916288,GRESTON HENRIQUE DE SOUZA,MG,IPATINGA,VEREADOR,DC,MASCULINO,ENSINO FUNDAMENTAL COMPLETO,PARDA,COMERCIANTE,0.0
1,130001921580,ROGERIO LEAL CAMPOS,MG,IPATINGA,VICE-PREFEITO,PRD,MASCULINO,SUPERIOR COMPLETO,BRANCA,POLICIAL MILITAR,1395000.0
2,130001905235,ERICA SIMONE ALMEIDA AMORIM MACHADO,MG,IPATINGA,VICE-PREFEITO,NOVO,FEMININO,ENSINO MÉDIO COMPLETO,BRANCA,TÉCNICO DE LABORATÓRIO E RAIOS X,6000.0
3,130001905274,GILMAR GOMES FERREIRA,MG,IPATINGA,VEREADOR,NOVO,MASCULINO,ENSINO MÉDIO COMPLETO,PARDA,MILITAR REFORMADO,340000.0
4,130001905234,EDVANIO ROSA CARNEIRO,MG,IPATINGA,PREFEITO,NOVO,MASCULINO,SUPERIOR COMPLETO,BRANCA,ADVOGADO,2927088.96
5,130001905253,MARIA DE FATIMA PEREIRA DE SOUZA,MG,IPATINGA,VEREADOR,PRD,FEMININO,SUPERIOR COMPLETO,BRANCA,ASSISTENTE SOCIAL,0.0
6,130002300187,ANA MARIA DA SILVA,MG,IPATINGA,VEREADOR,AVANTE,FEMININO,ENSINO MÉDIO COMPLETO,PARDA,TÉCNICO DE ENFERMAGEM E ASSEMELHADOS (EXCETO ENFERMEIRO),0.0
7,130002300192,SILVIO FERREIRA DA SILVA,MG,IPATINGA,VEREADOR,AVANTE,MASCULINO,ENSINO MÉDIO COMPLETO,PARDA,OUTROS,377900.0
8,130002160362,MARIA APARECIDA DE LIMA,MG,IPATINGA,VEREADOR,PT,FEMININO,SUPERIOR COMPLETO,NÃO INFORMADO,VEREADOR,182145.43
9,130002302347,HELOISIO JOSE DA SILVA,MG,IPATINGA,VEREADOR,AGIR,MASCULINO,ENSINO FUNDAMENTAL COMPLETO,PARDA,MOTORISTA PARTICULAR,202000.0
10,130002301616,ROSANA HENRIQUE DE ASSIS,MG,IPATINGA,VEREADOR,MDB,FEMININO,SUPERIOR COMPLETO,PARDA,APOSENTADO (EXCETO SERVIDOR PÚBLICO),0.0
11,130002301614,GERALDO AFONSO DE CARVALHO,MG,IPATINGA,VEREADOR,MDB,MASCULINO,ENSINO FUNDAMENTAL COMPLETO,PARDA,APOSENTADO (EXCETO SERVIDOR PÚBLICO),89000.0
12,130002211841,WERLEY GLICERIO FURBINO DE ARAUJO,MG,IPATINGA,VEREADOR,PL,MASCULINO,SUPERIOR COMPLETO,PARDA,POLICIAL CIVIL,252667.88
13,130002300648,JOB VICENTE RODRIGUES,MG,IPATINGA,VEREADOR,REDE,MASCULINO,ENSINO MÉDIO COMPLETO,PARDA,CATADOR DE RECICLÁVEIS,0.0
14,130001905262,ANDRÉ DE MELO FERREIRA,MG,IPATINGA,VEREADOR,PRD,MASCULINO,ENSINO MÉDIO COMPLETO,BRANCA,MOTORISTA DE VEÍCULOS DE TRANSPORTE DE CARGA,0.0
15,130001979074,NICOLAS RODRIGUES SILVEIRA,MG,IPATINGA,VEREADOR,REPUBLICANOS,MASCULINO,ENSINO MÉDIO COMPLETO,BRANCA,"ESTUDANTE, BOLSISTA, ESTAGIÁRIO E ASSEMELHADOS",8.6
16,130001979075,SAMIRA DE MENEZES ALVES,MG,IPATINGA,VEREADOR,REPUBLICANOS,FEMININO,ENSINO MÉDIO COMPLETO,BRANCA,"SECRETÁRIO,ESTENÓGRAFO,DATILÓGRAFO,RECEPCIONISTA,TELEFONISTA,TAQUÍGRAF",0.0
17,130002302990,GUSTAVO MORAIS NUNES,MG,IPATINGA,PREFEITO,PL,MASCULINO,SUPERIOR INCOMPLETO,PARDA,PREFEITO,483357.42
18,130002302340,JERFORY SAYMON FERREIRA COSTA,MG,IPATINGA,VEREADOR,AGIR,MASCULINO,SUPERIOR COMPLETO,PARDA,EMPRESÁRIO,20000.0
19,130002211845,GIELTON IVO DE ASSIS,MG,IPATINGA,VEREADOR,PL,MASCULINO,ENSINO MÉDIO COMPLETO,PARDA,POLICIAL MILITAR,219243.66
20,130002211231,EDSON FERREIRA DA COSTA,MG,IPATINGA,VEREADOR,PSB,MASCULINO,ENSINO MÉDIO COMPLETO,BRANCA,COMERCIANTE,14000.0
21,130001934778,VALDECI CHAVES DE OLIVEIRA,MG,IPATINGA,VEREADOR,UNIÃO,FEMININO,ENSINO FUNDAMENTAL COMPLETO,PARDA,COMERCIANTE,3500.0
22,130001916279,CARLA DO CARMO FERREIRA,MG,IPATINGA,VEREADOR,DC,FEMININO,ENSINO MÉDIO INCOMPLETO,PARDA,MANICURE E MAQUILADOR,0.0
23,130001905250,CÉLIO NOVAES JÚNIOR,MG,IPATINGA,VEREADOR,PRD,MASCULINO,SUPERIOR COMPLETO,BRANCA,ARQUITETO,0.0
24,130001916287,ANA MARIA APARECIDA GOMES,MG,IPATINGA,VEREADOR,DC,FEMININO,ENSINO FUNDAMENTAL INCOMPLETO,PARDA,CABELEIREIRO E BARBEIRO,115000.0
25,130001905266,EUSTÁQUIO ROSA DA SILVA,MG,IPATINGA,VEREADOR,PRD,MASCULINO,ENSINO MÉDIO COMPLETO,PARDA,SERVIDOR PÚBLICO MUNICIPAL,0.0
26,130002009647,FABIANA PEREIRA DA SILVA,MG,IPATINGA,VEREADOR,PP,FEMININO,ENSINO MÉDIO COMPLETO,PARDA,DONA DE CASA,1043.66
27,130002161849,CARLOS ALBERTO LIMA,MG,IPATINGA,VEREADOR,MOBILIZA,MASCULINO,ENSINO MÉDIO COMPLETO,PARDA,EMPRESÁRIO,877000.0
28,130002300658,JESUS DIAS DE ALMEIDA,MG,IPATINGA,VEREADOR,REDE,MASCULINO,ENSINO MÉDIO COMPLETO,PRETA,OUTROS,0.0
29,130002300196,JOAO VIANEI DE CARVALHO,MG,IPATINGA,VEREADOR,AVANTE,MASCULINO,SUPERIOR COMPLETO,BRANCA,VEREADOR,432994.32
30,130002302343,JOAQUIM GOMES DA SILVA,MG,IPATINGA,VEREADOR,AGIR,MASCULINO,ENSINO MÉDIO COMPLETO,PRETA,EMPRESÁRIO,0.0
31,130002166110,SEBASTIAO ANTONIO INACIO,MG,IPATINGA,VEREADOR,PRTB,MASCULINO,ENSINO MÉDIO COMPLETO,PARDA,APOSENTADO (EXCETO SERVIDOR PÚBLICO),98006.5
32,130002300646,CÁSSIA LOURENÇO VERÍSSIMO,MG,IPATINGA,VEREADOR,REDE,FEMININO,SUPERIOR COMPLETO,PARDA,ADVOGADO,0.0
33,130002162420,MICHAEL DAVISON DE OLIVEIRA RIBEIRO,MG,IPATINGA,PREFEITO,PSOL,MASCULINO,SUPERIOR COMPLETO,PARDA,ADVOGADO,0.0
34,130002300642,ELAINE CRISTINA BICALHO MAIA,MG,IPATINGA,VEREADOR,REDE,FEMININO,SUPERIOR COMPLETO,BRANCA,PROFESSOR DE ENSINO FUNDAMENTAL,0.0
35,130002211233,MARCOS VINICIUS DE OLIVEIRA ALMEIDA,MG,IPATINGA,VEREADOR,PSB,MASCULINO,ENSINO MÉDIO COMPLETO,PARDA,"TÉCNICO DE ELETRICIDADE, ELETRÔNICA E TELECOMUNICAÇÕES",40000.0
36,130002210905,LUIZ CLAUDIO DA COSTA,MG,IPATINGA,VEREADOR,PDT,MASCULINO,ENSINO FUNDAMENTAL COMPLETO,PRETA,TRABALHADOR FLORESTAL,3500.0
37,130002210902,EDUARDA VITORIA PINHO CARDOSO,MG,IPATINGA,VEREADOR,PDT,FEMININO,SUPERIOR COMPLETO,BRANCA,"ESTUDANTE, BOLSISTA, ESTAGIÁRIO E ASSEMELHADOS",0.0
38,130001905282,CLAUDIMAR DE ALVARENGA MORAIS,MG,IPATINGA,VEREADOR,NOVO,MASCULINO,SUPERIOR COMPLETO,BRANCA,ENGENHEIRO,120000.0
39,130002162218,RONALDO FERNANDES MADEIRA,MG,IPATINGA,VEREADOR,PMB,MASCULINO,ENSINO FUNDAMENTAL INCOMPLETO,PRETA,"ENCANADOR, SOLDADOR, CHAPEADOR E CALDEIREIRO",0.0
40,130002009655,WANDERCY GOMES DE OLIVEIRA,MG,IPATINGA,VEREADOR,PP,MASCULINO,SUPERIOR COMPLETO,PARDA,OUTROS,1220.12
41,130002162213,DIEGO FAGUNDES LIMA,MG,IPATINGA,VEREADOR,PMB,MASCULINO,ENSINO MÉDIO COMPLETO,PARDA,OUTROS,1259.06
42,130001979070,CLEUDES SILVEIRA LAGE,MG,IPATINGA,VEREADOR,REPUBLICANOS,FEMININO,SUPERIOR COMPLETO,BRANCA,RECEPCIONISTA,110000.0
43,130002160695,JOAO FRANCISCO BASTOS,MG,IPATINGA,VEREADOR,CIDADANIA,MASCULINO,LÊ E ESCREVE,BRANCA,VEREADOR,268396.0
44,130002166101,DANIEL AMBROSIO DA CONCEIÇÃO PEREIRA,MG,IPATINGA,VEREADOR,PRTB,MASCULINO,ENSINO FUNDAMENTAL COMPLETO,PRETA,MOTORISTA DE VEÍCULOS DE TRANSPORTE DE CARGA,548000.0
45,130002300191,RODRIGO CARLOS MORAES BOAVENTURA,MG,IPATINGA,VEREADOR,AVANTE,MASCULINO,SUPERIOR INCOMPLETO,PARDA,OUTROS,0.0
46,130001934779,ROSIANI KATIA CRUZ DE ARRUDA,MG,IPATINGA,VEREADOR,UNIÃO,FEMININO,ENSINO MÉDIO INCOMPLETO,PARDA,APOSENTADO (EXCETO SERVIDOR PÚBLICO),3400.0
47,130002211218,ANAUIL SOARES,MG,IPATINGA,VEREADOR,PSB,MASCULINO,ENSINO MÉDIO INCOMPLETO,PARDA,COMERCIANTE,0.0
48,130002380925,NELMA SILVA PINHO,MG,IPATINGA,VEREADOR,CIDADANIA,FEMININO,ENSINO MÉDIO COMPLETO,PARDA,COMERCIANTE,0.0
49,130002301623,REGINALDO GARCIA FERNANDES,MG,IPATINGA,VEREADOR,MDB,MASCULINO,ENSINO MÉDIO COMPLETO,PARDA,APOSENTADO (EXCETO SERVIDOR PÚBLICO),5000.0
50,130001905258,VAGNER LISBOA DE SOUZA,MG,IPATINGA,VEREADOR,PRD,MASCULINO,SUPERIOR COMPLETO,BRANCA,ENGENHEIRO,0.0
51,130001916283,JAMES ALVES DOS REIS,MG,IPATINGA,VEREADOR,DC,MASCULINO,ENSINO MÉDIO COMPLETO,PARDA,SERVIDOR PÚBLICO MUNICIPAL,10000.0
52,130002160360,ROBERTO BOTELHO RODRIGUES,MG,IPATINGA,VEREADOR,PT,MASCULINO,ENSINO FUNDAMENTAL INCOMPLETO,PARDA,OUTROS,0.0
53,130002165926,JADSON HELENO MOREIRA,MG,IPATINGA,PREFEITO,PRTB,MASCULINO,SUPERIOR COMPLETO,BRANCA,EMPRESÁRIO,308928.3
54,130002161851,LEONARDO DE OLIVEIRA MIRANDA,MG,IPATINGA,VEREADOR,MOBILIZA,MASCULINO,ENSINO MÉDIO COMPLETO,PARDA,OUTROS,560000.0
55,130002302350,ROSELE MARIA SOUZA DE CASTRO,MG,IPATINGA,VEREADOR,AGIR,FEMININO,SUPERIOR COMPLETO,PARDA,FISIOTERAPEUTA E TERAPEUTA OCUPACIONAL,0.0
56,130002211858,MELQUIS EDELSON LOPES,MG,IPATINGA,VEREADOR,PL,MASCULINO,ENSINO MÉDIO COMPLETO,PARDA,OUTROS,20000.0
57,130002211843,MARIA JULIA BOMFIM PEREIRA,MG,IPATINGA,VEREADOR,PL,FEMININO,ENSINO MÉDIO COMPLETO,PARDA,OUTROS,0.0
58,130001916276,GISELE KATIUSCIA DOS REIS SOARES,MG,IPATINGA,VEREADOR,DC,FEMININO,LÊ E ESCREVE,PARDA,VENDEDOR DE COMÉRCIO VAREJISTA E ATACADISTA,0.0
59,130001916275,MATHEUS LIMA BRAGA,MG,IPATINGA,VEREADOR,DC,MASCULINO,SUPERIOR COMPLETO,BRANCA,ADVOGADO,75797.75
60,130001905270,ELIANE SIMOES MARCHESINI FONSECA,MG,IPATINGA,VEREADOR,NOVO,FEMININO,SUPERIOR COMPLETO,PARDA,APOSENTADO (EXCETO SERVIDOR PÚBLICO),537999.12
61,130001916277,JULIANA GONÇALVES SOUZA,MG,IPATINGA,VEREADOR,DC,FEMININO,ENSINO MÉDIO COMPLETO,BRANCA,OUTROS,315000.0
62,130002300653,ANTONIO DE PAULA ALVES,MG,IPATINGA,VEREADOR,REDE,MASCULINO,ENSINO FUNDAMENTAL COMPLETO,PARDA,APOSENTADO (EXCETO SERVIDOR PÚBLICO),0.0
63,130001905287,WALDIVINO PINTO,MG,IPATINGA,VEREADOR,NOVO,MASCULINO,ENSINO MÉDIO COMPLETO,PARDA,MECÂNICO DE MANUTENÇÃO,150000.0
64,130002300645,MARIA DA CONCEICAO NASCIMENTO,MG,IPATINGA,VEREADOR,REDE,FEMININO,SUPERIOR COMPLETO,PARDA,OUTROS,0.0
65,130002302333,SEBASTIAO EVANGELISTA,MG,IPATINGA,VEREADOR,AGIR,MASCULINO,ENSINO MÉDIO COMPLETO,PRETA,OUTROS,300000.0
66,130001979066,MOARLEN LANDE COELHO,MG,IPATINGA,VEREADOR,REPUBLICANOS,MASCULINO,SUPERIOR COMPLETO,PRETA,AGENTE DE SAÚDE E SANITARISTA,127225.42
67,130002301619,EDILSON SILVA DOS SANTOS,MG,IPATINGA,VEREADOR,MDB,MASCULINO,ENSINO MÉDIO COMPLETO,PARDA,LEITURISTA,0.0
68,130002300660,THIAGO HENRIQUE ALMEIDA VAZ,MG,IPATINGA,VEREADOR,REDE,MASCULINO,SUPERIOR COMPLETO,BRANCA,PROFESSOR DE ENSINO MÉDIO,0.0
69,130002302345,WEBER INACIO OLIVEIRA BRITO,MG,IPATINGA,VEREADOR,AGIR,MASCULINO,SUPERIOR COMPLETO,PRETA,PROFESSOR E INSTRUTOR DE FORMAÇÃO PROFISSIONAL,0.0
70,130002300656,DIANNE SHIRLEY DE OLIVEIRA,MG,IPATINGA,VEREADOR,REDE,FEMININO,SUPERIOR COMPLETO,BRANCA,ADVOGADO,0.0
71,130002300204,MATEUS TELES DE SOUSA,MG,IPATINGA,VEREADOR,AVANTE,MASCULINO,SUPERIOR COMPLETO,PARDA,OUTROS,0.0
72,130002300189,BRUNO VIEIRA DOS SANTOS,MG,IPATINGA,VEREADOR,AVANTE,MASCULINO,ENSINO MÉDIO COMPLETO,PARDA,VIGILANTE,6000.0
73,130002211224,ISAEL LUCAS TEIXEIRA,MG,IPATINGA,VEREADOR,PSB,MASCULINO,ENSINO FUNDAMENTAL COMPLETO,PARDA,"TÉCNICO DE OBRAS CIVIS, ESTRADAS, SANEAMENTO E ASSEMELHADOS",69000.0
74,130002210901,ROSANGELA CUSTÓDIA GABRIEL,MG,IPATINGA,VEREADOR,PDT,FEMININO,SUPERIOR INCOMPLETO,PRETA,APOSENTADO (EXCETO SERVIDOR PÚBLICO),225000.0
75,130001934786,GERALDO ROMUALDO DOS SANTOS,MG,IPATINGA,VEREADOR,UNIÃO,MASCULINO,ENSINO MÉDIO COMPLETO,PARDA,APOSENTADO (EXCETO SERVIDOR PÚBLICO),13000.0
76,130001916278,MARISE GUIMARAES SANTOS SILVA,MG,IPATINGA,VEREADOR,DC,FEMININO,ENSINO MÉDIO COMPLETO,PARDA,ARTESÃO,1100000.0
77,130001905259,ILDEU SEBASTIÃO DE MEIRELES,MG,IPATINGA,VEREADOR,PRD,MASCULINO,ENSINO MÉDIO COMPLETO,BRANCA,MOTORISTA DE VEÍCULOS DE TRANSPORTE COLETIVO DE PASSAGEIROS,0.0
78,130001905285,JOSE DE FREITAS SILVA,MG,IPATINGA,VEREADOR,NOVO,MASCULINO,ENSINO FUNDAMENTAL INCOMPLETO,PARDA,APOSENTADO (EXCETO SERVIDOR PÚBLICO),0.0
79,130002301100,RAIR ANÍCIO JÚNIOR,MG,IPATINGA,VICE-PREFEITO,PSTU,MASCULINO,SUPERIOR COMPLETO,PARDA,INDUSTRIAL,845000.0
80,130001905280,ALBERTO ANDRADE GUIMARAES,MG,IPATINGA,VEREADOR,NOVO,MASCULINO,ENSINO FUNDAMENTAL INCOMPLETO,PARDA,APOSENTADO (EXCETO SERVIDOR PÚBLICO),46617.0
81,130002162225,WELLINGTON GOMES RAMOS,MG,IPATINGA,VEREADOR,PMB,MASCULINO,ENSINO MÉDIO COMPLETO,PARDA,EMPRESÁRIO,700000.0
82,130002301611,DEIR BARBOSA DE LACERDA,MG,IPATINGA,VEREADOR,MDB,MASCULINO,ENSINO MÉDIO COMPLETO,PARDA,COMERCIANTE,310000.0
83,130002300201,JOSIAS ATIL LEMOS,MG,IPATINGA,VEREADOR,AVANTE,MASCULINO,ENSINO FUNDAMENTAL COMPLETO,PARDA,OUTROS,0.0
84,130002300195,GERALDO PINTO BARBOSA,MG,IPATINGA,VEREADOR,AVANTE,MASCULINO,ENSINO FUNDAMENTAL COMPLETO,PARDA,COMERCIANTE,35000.0
85,130002162217,JOEL AVELINO SOUTO,MG,IPATINGA,VEREADOR,PMB,MASCULINO,SUPERIOR COMPLETO,PRETA,JORNALISTA E REDATOR,0.0
86,130002160693,ADRIANA BRITO DE OLIVEIRA,MG,IPATINGA,VEREADOR,PSDB,FEMININO,SUPERIOR COMPLETO,PARDA,PEDAGOGO,0.0
87,130001979067,DANIEL ROSA DE PINHO,MG,IPATINGA,VEREADOR,REPUBLICANOS,MASCULINO,ENSINO FUNDAMENTAL INCOMPLETO,PARDA,EMPRESÁRIO,1761000.0
88,130002211849,DEUSEDINA MONICA LEMOS BRAGA BORGES,MG,IPATINGA,VEREADOR,PL,FEMININO,SUPERIOR COMPLETO,BRANCA,OUTROS,0.0
89,130001934789,VICENTE CALIXTO,MG,IPATINGA,VEREADOR,UNIÃO,MASCULINO,ENSINO FUNDAMENTAL COMPLETO,BRANCA,APOSENTADO (EXCETO SERVIDOR PÚBLICO),40161.44
90,130002211234,JUSTINO FERREIRA RIBEIRO,MG,IPATINGA,VEREADOR,PSB,MASCULINO,ENSINO FUNDAMENTAL COMPLETO,PARDA,COMERCIANTE,583500.0
91,130002385078,JANAINA FERNANDES CARVALHO,MG,IPATINGA,VEREADOR,PRTB,FEMININO,ENSINO MÉDIO COMPLETO,PARDA,MOTORISTA PARTICULAR,118000.0
92,130001905277,AECIO SALVADOR DE ANDRADE,MG,IPATINGA,VEREADOR,NOVO,MASCULINO,ENSINO MÉDIO COMPLETO,BRANCA,APOSENTADO (EXCETO SERVIDOR PÚBLICO),23000.0
93,130001916282,CRISPIM ELIAS CAMPOS NETO,MG,IPATINGA,VEREADOR,DC,MASCULINO,ENSINO FUNDAMENTAL COMPLETO,PARDA,APOSENTADO (EXCETO SERVIDOR PÚBLICO),81729.56
94,130001905261,RONILSON PEREIRA DE SOUZA,MG,IPATINGA,VEREADOR,PRD,MASCULINO,ENSINO MÉDIO COMPLETO,PARDA,EMPRESÁRIO,0.0
95,130002160686,ADEMAR DA COSTA NEVES,MG,IPATINGA,VEREADOR,CIDADANIA,MASCULINO,ENSINO FUNDAMENTAL INCOMPLETO,PRETA,OUTROS,0.0
96,130001916274,SERGIO MORAIS COELHO,MG,IPATINGA,VEREADOR,DC,MASCULINO,ENSINO FUNDAMENTAL COMPLETO,BRANCA,OUTROS,268000.0
97,130001905256,JUBER CHAVES DA SILVA,MG,IPATINGA,VEREADOR,PRD,MASCULINO,ENSINO MÉDIO COMPLETO,BRANCA,APOSENTADO (EXCETO SERVIDOR PÚBLICO),0.0
98,130002161855,CARLOS ALBERTO CORREA DE ASSIS,MG,IPATINGA,VEREADOR,MOBILIZA,MASCULINO,ENSINO MÉDIO COMPLETO,PARDA,APOSENTADO (EXCETO SERVIDOR PÚBLICO),0.0
99,130002302342,SAVIO DAMAZIO DE OLIVEIRA,MG,IPATINGA,VEREADOR,AGIR,MASCULINO,ENSINO MÉDIO COMPLETO,PRETA,"SUPERVISOR, INSPETOR E AGENTE DE COMPRAS E VENDAS",0.0
100,130002009648,AVELINO RIBEIRO DA CRUZ,MG,IPATINGA,VEREADOR,PP,MASCULINO,SUPERIOR COMPLETO,PARDA,OUTROS,104603.0
101,130002161848,JOSÉ MODESTO,MG,IPATINGA,VEREADOR,MOBILIZA,MASCULINO,ENSINO FUNDAMENTAL COMPLETO,PARDA,VIGILANTE,0.0
102,130002300649,ALEXSANDRO ESPÍRITO SANTO OLIVEIRA,MG,IPATINGA,VEREADOR,REDE,MASCULINO,SUPERIOR COMPLETO,PARDA,EMPRESÁRIO,0.0
103,130002301099,GLAUBER MACHADO FERREIRA,MG,IPATINGA,PREFEITO,PSTU,MASCULINO,SUPERIOR COMPLETO,BRANCA,ADVOGADO,14800.0
104,130002042286,MICHEL NEVES WINTER,MG,IPATINGA,PREFEITO,PRTB,MASCULINO,SUPERIOR COMPLETO,PARDA,EMPRESÁRIO,200000.0
105,130002210895,JOÃO BATISTA DA SILVA,MG,IPATINGA,VEREADOR,PDT,MASCULINO,ENSINO FUNDAMENTAL COMPLETO,PRETA,AGENTE DE SAÚDE E SANITARISTA,260000.0
106,130002211221,EVERTON GERMANO GOMES DA SILVA,MG,IPATINGA,VEREADOR,PSB,MASCULINO,SUPERIOR COMPLETO,PRETA,VIGILANTE,143000.0
107,130002211853,AMARILDO PEREIRA DA SILVA,MG,IPATINGA,VEREADOR,PL,MASCULINO,ENSINO MÉDIO COMPLETO,PARDA,OUTROS,55441.06
108,130002382175,MARCOS OLIVEIRA RODRIGUES,MG,IPATINGA,VEREADOR,REPUBLICANOS,MASCULINO,ENSINO MÉDIO COMPLETO,BRANCA,EMPRESÁRIO,232019.51
109,130002302346,HELVECIO PINTO DOS SANTOS,MG,IPATINGA,VEREADOR,AGIR,MASCULINO,ENSINO MÉDIO COMPLETO,PARDA,APOSENTADO (EXCETO SERVIDOR PÚBLICO),418000.0
110,130002009640,ROGERIO SILVA ABREU,MG,IPATINGA,VEREADOR,PP,MASCULINO,ENSINO MÉDIO COMPLETO,PARDA,MOTORISTA PARTICULAR,73828.84
111,130002166106,RODRIGO LIBERATO DIAS,MG,IPATINGA,VEREADOR,PRTB,MASCULINO,ENSINO MÉDIO COMPLETO,PARDA,TRABALHADOR METALÚRGICO E SIDERÚRGICO,5000.0
112,130002162215,JHON WESLEY FERREIRA DE SOUZA,MG,IPATINGA,VEREADOR,PMB,MASCULINO,SUPERIOR COMPLETO,PARDA,VENDEDOR DE COMÉRCIO VAREJISTA E ATACADISTA,327900.0
113,130002160359,WILLIAM GOMES DE OLIVEIRA LOPES,MG,IPATINGA,VEREADOR,PT,MASCULINO,ENSINO FUNDAMENTAL INCOMPLETO,PARDA,FRENTISTA,0.0
114,130002160689,MARIA FRANCISCA DE JESUS,MG,IPATINGA,VEREADOR,CIDADANIA,FEMININO,ENSINO MÉDIO COMPLETO,PRETA,APOSENTADO (EXCETO SERVIDOR PÚBLICO),180000.0
115,130001979080,MATEUS FAIER DA SILVA,MG,IPATINGA,VEREADOR,REPUBLICANOS,MASCULINO,SUPERIOR COMPLETO,PARDA,ADVOGADO,100.12
116,130002162223,HELLEN DA SILVA CUSTODIO DE MELO,MG,IPATINGA,VEREADOR,PMB,FEMININO,SUPERIOR COMPLETO,PARDA,PSICÓLOGO,182000.0
117,130002166108,EDVALDO ALVES DE SOUZA,MG,IPATINGA,VEREADOR,PRTB,MASCULINO,ENSINO MÉDIO COMPLETO,BRANCA,TÉCNICO DE MECÂNICA,0.0
118,130002211852,MARIA IMACULADA ROCHA OLIVEIRA DE NOVAES,MG,IPATINGA,VEREADOR,PL,FEMININO,ENSINO MÉDIO COMPLETO,PRETA,COMERCIANTE,139000.0
119,130002380170,DIRCE ALMEIDA SANTOS,MG,IPATINGA,VEREADOR,REPUBLICANOS,FEMININO,ENSINO FUNDAMENTAL INCOMPLETO,PARDA,OUTROS,360508.51
120,130002009644,CARLOS ROBERTO DE SOUZA,MG,IPATINGA,VEREADOR,PP,MASCULINO,ENSINO FUNDAMENTAL INCOMPLETO,BRANCA,APOSENTADO (EXCETO SERVIDOR PÚBLICO),366304.92
121,130002300651,PAULA PINA REZENDE GONÇALVES,MG,IPATINGA,VEREADOR,REDE,FEMININO,SUPERIOR COMPLETO,PARDA,PROFESSOR DE ENSINO DE PRIMEIRO E SEGUNDO GRAUS,0.0
122,130002301938,JESUS NASCIMENTO DA SILVA,MG,IPATINGA,VICE-PREFEITO,MDB,MASCULINO,SUPERIOR COMPLETO,BRANCA,ADVOGADO,19201673.6
123,130002301628,SORAYA SOARES DE ARAUJO,MG,IPATINGA,VEREADOR,MDB,FEMININO,SUPERIOR COMPLETO,BRANCA,APOSENTADO (EXCETO SERVIDOR PÚBLICO),236779.82
124,130002166102,ANDRE DOS SANTOS MOREIRA,MG,IPATINGA,VEREADOR,PRTB,MASCULINO,ENSINO MÉDIO COMPLETO,PARDA,OUTROS,15000.0
125,130002302338,ANTONIO JOSE FERREIRA NETO,MG,IPATINGA,VEREADOR,AGIR,MASCULINO,ENSINO MÉDIO COMPLETO,PARDA,VEREADOR,1027766.84
126,130001934792,SIMONE SIERAU SHIKAY,MG,IPATINGA,VEREADOR,UNIÃO,FEMININO,ENSINO MÉDIO INCOMPLETO,BRANCA,OUTROS,7015.46
127,130002211232,ANA RITA NEVES ASSIS,MG,IPATINGA,VEREADOR,PSB,FEMININO,SUPERIOR COMPLETO,PARDA,COMERCIANTE,67000.0
128,130002376571,DANIELA VON RONDOW COSTA,MG,IPATINGA,VEREADOR,PP,FEMININO,SUPERIOR INCOMPLETO,PARDA,OUTROS,29065.0
129,130001916281,MARCO ANTONIO GOMES TOLEDO,MG,IPATINGA,VEREADOR,DC,MASCULINO,SUPERIOR COMPLETO,BRANCA,POLICIAL MILITAR,1550000.0
130,130002160687,CARLOS SILVA SANTOS,MG,IPATINGA,VEREADOR,CIDADANIA,MASCULINO,ENSINO MÉDIO COMPLETO,PARDA,OUTROS,0.0
131,130002301622,REGINALDO GONCALVES COELHO,MG,IPATINGA,VEREADOR,MDB,MASCULINO,ENSINO MÉDIO COMPLETO,PRETA,"CORRETOR DE IMÓVEIS, SEGUROS, TÍTULOS E VALORES",250000.0
132,130002300650,WANDERLEI JOSE SOARES,MG,IPATINGA,VEREADOR,REDE,MASCULINO,ENSINO MÉDIO COMPLETO,BRANCA,COMERCIANTE,0.0
133,130002009639,ANTONIO ALVES DE OLIVEIRA,MG,IPATINGA,VEREADOR,PP,MASCULINO,ENSINO MÉDIO COMPLETO,BRANCA,VEREADOR,551700.0
134,130002302344,CLAUDIA GLEYCE NOVAIS,MG,IPATINGA,VEREADOR,AGIR,FEMININO,SUPERIOR COMPLETO,PARDA,OUTROS,35000.0
135,130002302989,JOSE PEDRO DE FREITAS,MG,IPATINGA,VICE-PREFEITO,CIDADANIA,MASCULINO,SUPERIOR COMPLETO,PARDA,APOSENTADO (EXCETO SERVIDOR PÚBLICO),0.0
136,130002211839,CLAUDEMIR RODRIGUES DUARTE DE JESUS,MG,IPATINGA,VEREADOR,PL,MASCULINO,ENSINO FUNDAMENTAL INCOMPLETO,PRETA,OUTROS,250000.0
137,130002210888,GERALDA LUCIA SILVA ALMEIDA,MG,IPATINGA,VEREADOR,PDT,FEMININO,SUPERIOR COMPLETO,PARDA,APOSENTADO (EXCETO SERVIDOR PÚBLICO),0.0
138,130002210892,ADRIANO OTAVIO CORDEIRO FELIPE,MG,IPATINGA,VEREADOR,PDT,MASCULINO,SUPERIOR COMPLETO,PRETA,TÉCNICO DE ENFERMAGEM E ASSEMELHADOS (EXCETO ENFERMEIRO),149000.0
139,130001979072,FABIO PEREIRA DOS SANTOS,MG,IPATINGA,VEREADOR,REPUBLICANOS,MASCULINO,SUPERIOR INCOMPLETO,PARDA,COMERCIANTE,3855.02
140,130002162419,RENNAN VILAR GUIMARAES CASTRO ANTUNES,MG,IPATINGA,VICE-PREFEITO,PSOL,MASCULINO,SUPERIOR COMPLETO,BRANCA,OUTROS,533920.79
141,130002162220,MISLENE GODOY LUCAS,MG,IPATINGA,VEREADOR,PMB,FEMININO,SUPERIOR COMPLETO,PARDA,OUTROS,25000.0
142,130002300643,LEONARDO MARCOS DE SOUZA,MG,IPATINGA,VEREADOR,REDE,MASCULINO,ENSINO MÉDIO COMPLETO,PARDA,OUTROS,0.0
143,130001979063,AUDREY QUESIA PASSOS BOWEN,MG,IPATINGA,VEREADOR,REPUBLICANOS,FEMININO,SUPERIOR COMPLETO,BRANCA,PROFESSOR E INSTRUTOR DE FORMAÇÃO PROFISSIONAL,29000.0
144,130002162212,ELIAS MOREIRA JUNIOR,MG,IPATINGA,VEREADOR,PMB,MASCULINO,SUPERIOR COMPLETO,PARDA,OUTROS,25880.0
145,130002009645,MANOEL MOREIRA FRANCO,MG,IPATINGA,VEREADOR,PP,MASCULINO,ENSINO FUNDAMENTAL INCOMPLETO,PARDA,OUTROS,0.0
146,130002160699,JOSIAS VARGAS DA SILVA,MG,IPATINGA,VEREADOR,CIDADANIA,MASCULINO,ENSINO MÉDIO INCOMPLETO,PRETA,OUTROS,25000.0
147,130002301624,ADRIANA PEREIRA RODRIGUES ALMEIDA,MG,IPATINGA,VEREADOR,MDB,FEMININO,ENSINO MÉDIO COMPLETO,PARDA,EMPRESÁRIO,650211.0
148,130002211217,MARCIO ROBERTO REIS MIRANDA,MG,IPATINGA,VEREADOR,PSB,MASCULINO,SUPERIOR COMPLETO,BRANCA,ENFERMEIRO,0.0
149,130002210900,SEBASTIÃO DOMINGOS DE SOUZA,MG,IPATINGA,VEREADOR,PDT,MASCULINO,ENSINO FUNDAMENTAL COMPLETO,PARDA,OPERADOR DE APARELHOS DE PRODUÇÃO INDUSTRIAL,400000.0
150,130001916290,ROGERIO ALVES FERREIRA,MG,IPATINGA,VEREADOR,DC,MASCULINO,SUPERIOR COMPLETO,PARDA,OUTROS,12000.0
151,130001905279,PATRICIA SENA DE SOUZA,MG,IPATINGA,VEREADOR,NOVO,FEMININO,ENSINO MÉDIO COMPLETO,PARDA,CABELEIREIRO E BARBEIRO,13500.0
152,130001905278,BLANDER ROGER DO COUTO NARCISO,MG,IPATINGA,VEREADOR,NOVO,MASCULINO,SUPERIOR COMPLETO,BRANCA,ENGENHEIRO,62.99
153,130002300190,WALDEMIR DOS SANTOS,MG,IPATINGA,VEREADOR,AVANTE,MASCULINO,ENSINO FUNDAMENTAL COMPLETO,PRETA,OUTROS,0.0
154,130002161854,VANILSA DIAS MARTINS,MG,IPATINGA,VEREADOR,MOBILIZA,FEMININO,ENSINO MÉDIO COMPLETO,PARDA,OUTROS,0.0
155,130002300200,DENER CRISTIAN DAMASCENO VALADARES,MG,IPATINGA,VEREADOR,AVANTE,MASCULINO,ENSINO MÉDIO COMPLETO,PRETA,OUTROS,75000.0
156,130002302335,RENATA DE SOUZA SILVA FONSECA,MG,IPATINGA,VEREADOR,AGIR,FEMININO,SUPERIOR COMPLETO,PARDA,OUTROS,0.0
157,130002301615,IRIS MATILDE DA SILVA,MG,IPATINGA,VEREADOR,MDB,MASCULINO,ENSINO MÉDIO COMPLETO,PRETA,APOSENTADO (EXCETO SERVIDOR PÚBLICO),250000.0
158,130002300644,LUIS ANTONIO DE SOUZA VIEIRA,MG,IPATINGA,VEREADOR,REDE,MASCULINO,ENSINO FUNDAMENTAL COMPLETO,PARDA,MOTORISTA DE VEÍCULOS DE TRANSPORTE COLETIVO DE PASSAGEIROS,0.0
159,130002160358,RENATO PINTO MICHISHITA,MG,IPATINGA,VEREADOR,PT,MASCULINO,SUPERIOR COMPLETO,BRANCA,"TRADUTOR, INTÉRPRETE E FILÓLOGO",55514.5
160,130002379347,LENI DO CARMO ALVES,MG,IPATINGA,VEREADOR,CIDADANIA,FEMININO,SUPERIOR COMPLETO,PARDA,PEDAGOGO,0.0
161,130001934781,MARIA DE FÁTIMA SOUZA CARLOS,MG,IPATINGA,VEREADOR,UNIÃO,FEMININO,ENSINO MÉDIO COMPLETO,PARDA,APOSENTADO (EXCETO SERVIDOR PÚBLICO),51008.29
162,130001934788,SILVANE GIVISIEZ,MG,IPATINGA,VEREADOR,UNIÃO,MASCULINO,SUPERIOR COMPLETO,BRANCA,MILITAR REFORMADO,2027119.37
163,130002211223,WENDER DE SOUZA CARVALHO,MG,IPATINGA,VEREADOR,PSB,MASCULINO,ENSINO MÉDIO COMPLETO,PARDA,OUTROS,800000.0
164,130002210893,SUELY SILVA LEITE DOS SANTOS,MG,IPATINGA,VEREADOR,PDT,FEMININO,ENSINO MÉDIO COMPLETO,PARDA,AGENTE ADMINISTRATIVO,0.0
165,130002211857,JULIMAR RODRIGUES FERREIRA,MG,IPATINGA,VEREADOR,PL,MASCULINO,SUPERIOR COMPLETO,PARDA,OUTROS,250000.0
166,130001934785,WALTER PATRICIO DE SOUZA,MG,IPATINGA,VEREADOR,UNIÃO,MASCULINO,ENSINO MÉDIO COMPLETO,PARDA,APOSENTADO (EXCETO SERVIDOR PÚBLICO),600000.0
167,130002381065,DEGUIMAR APARECIDA DE SOUZA,MG,IPATINGA,VEREADOR,REPUBLICANOS,FEMININO,SUPERIOR COMPLETO,PARDA,OUTROS,1363.0500000000002
168,130001905260,QUEZIA ROCHA EVANGELISTA,MG,IPATINGA,VEREADOR,PRD,FEMININO,ENSINO MÉDIO COMPLETO,BRANCA,VENDEDOR DE COMÉRCIO VAREJISTA E ATACADISTA,0.0
169,130002160363,USÂNIA APARECIDA GOMES,MG,IPATINGA,VEREADOR,PT,FEMININO,SUPERIOR COMPLETO,PRETA,ASSISTENTE SOCIAL,0.0
170,130002166099,HERALDO ROCHA FILHO,MG,IPATINGA,VEREADOR,PRTB,MASCULINO,ENSINO FUNDAMENTAL INCOMPLETO,PARDA,OUTROS,0.0
171,130002160366,LEONARDO PATRICK SOUZA SILVA,MG,IPATINGA,VEREADOR,PT,MASCULINO,SUPERIOR COMPLETO,INDÍGENA,CIENTISTA POLÍTICO,0.0
172,130002161861,JOAO PAULO BARBOSA PORTELA DORNELES,MG,IPATINGA,VEREADOR,MOBILIZA,MASCULINO,ENSINO MÉDIO COMPLETO,PARDA,OUTROS,172000.0
173,130002300647,FLAVIO JOSE SILVA PINTO,MG,IPATINGA,VEREADOR,REDE,MASCULINO,ENSINO MÉDIO COMPLETO,BRANCA,COMERCIANTE,0.0
174,130002210898,JOAO CRISOSTOMO DOS PASSOS,MG,IPATINGA,VEREADOR,PDT,MASCULINO,ENSINO FUNDAMENTAL INCOMPLETO,BRANCA,APOSENTADO (EXCETO SERVIDOR PÚBLICO),11500.0
175,130001934780,GILMAR DOS ANJOS ARAUJO,MG,IPATINGA,VEREADOR,UNIÃO,MASCULINO,ENSINO MÉDIO COMPLETO,PARDA,"CORRETOR DE IMÓVEIS, SEGUROS, TÍTULOS E VALORES",0.0
176,130002211856,ENEIAS VAZ DE SOUZA,MG,IPATINGA,VEREADOR,PL,MASCULINO,ENSINO MÉDIO COMPLETO,PARDA,OUTROS,77668.01
177,130001921581,ALESSANDRA SILVA RIBEIRO,MG,IPATINGA,PREFEITO,PRD,FEMININO,SUPERIOR COMPLETO,BRANCA,ADVOGADO,1206000.0
178,130001916286,ROSENI LOPES JERÔNIMO,MG,IPATINGA,VEREADOR,DC,FEMININO,ENSINO FUNDAMENTAL INCOMPLETO,PRETA,SERVIDOR PÚBLICO MUNICIPAL,0.0
179,130002300194,GISLAINE CARLOS DE OLIVEIRA,MG,IPATINGA,VEREADOR,AVANTE,FEMININO,ENSINO FUNDAMENTAL INCOMPLETO,BRANCA,OUTROS,0.0
180,130001979076,WAGNER ALVARENGA SIMÕES,MG,IPATINGA,VEREADOR,REPUBLICANOS,MASCULINO,SUPERIOR COMPLETO,BRANCA,POLICIAL MILITAR,444394.91
181,130001905249,TIAGO ALVES DA SILVA,MG,IPATINGA,VEREADOR,PRD,MASCULINO,ENSINO MÉDIO COMPLETO,PARDA,MOTORISTA PARTICULAR,0.0
182,130002009651,CLEIDMAR FERREIRA EDUARDO,MG,IPATINGA,VEREADOR,PP,FEMININO,ENSINO MÉDIO COMPLETO,PARDA,APOSENTADO (EXCETO SERVIDOR PÚBLICO),330000.65
183,130002162222,MARCOS DE OLIVEIRA GOMES,MG,IPATINGA,VEREADOR,PMB,MASCULINO,SUPERIOR COMPLETO,PRETA,MÚSICO,159215.4
184,130002162211,NALDO JOSE SOARES,MG,IPATINGA,VEREADOR,PMB,MASCULINO,SUPERIOR COMPLETO,BRANCA,OUTROS,62900.0
185,130002161856,DENER JUDSON DE SOUZA,MG,IPATINGA,VEREADOR,MOBILIZA,MASCULINO,SUPERIOR COMPLETO,PARDA,OUTROS,0.0
186,130002379345,ELOI VASCONCELOS LUCIANO,MG,IPATINGA,VEREADOR,PSDB,MASCULINO,SUPERIOR COMPLETO,PARDA,ADVOGADO,140000.0
187,130001934784,MARIA APARECIDA DE OLIVEIRA FLORENTINO,MG,IPATINGA,VEREADOR,UNIÃO,FEMININO,ENSINO MÉDIO COMPLETO,PRETA,"CABELEIREIRO, BARBEIRO, MANICURE, MAQUILADOR, ESTETICISTA E MASSAGISTA",18396.88
188,130002210890,JOSUÉ MACHADO DA VITORIA,MG,IPATINGA,VEREADOR,PDT,MASCULINO,ENSINO FUNDAMENTAL COMPLETO,PARDA,COMERCIÁRIO,0.0
189,130002161853,JORGE DE SOUZA PINTO,MG,IPATINGA,VEREADOR,MOBILIZA,MASCULINO,SUPERIOR COMPLETO,PARDA,APOSENTADO (EXCETO SERVIDOR PÚBLICO),540582.0
190,130002160367,APARECIDA DE FÁTIMA LUIZ DE ANDRADE,MG,IPATINGA,VEREADOR,PT,FEMININO,SUPERIOR COMPLETO,PRETA,OUTROS,0.0
